{
  "version": 1,
  "generated_at": "2026-06-05T20:13:18Z",
  "repo_root": "/home/mrohr/appsec-advisor/tests/fixtures/e2e/synthetic-repo",
  "routes": [],
  "coverage": {
    "frameworks_detected": [],
    "unsupported_route_files": [],
    "route_count": 0,
    "management_surface_count": 0,
    "missing_auth_suspect_count": 0
  }
}
